{
  "document_id": "doc_a1b2c3d4e5f60718",
  "work_id": "work_9876543210fedcba",
  "sha256": "a1b2c3d4e5f60718293847561029384756102938475610293847561029384756",
  "format": "docx",
  "version": "unknown",
  "title": "Robust Transformer Models for Optical Flow",
  "authors": [
    "Alice Smith",
    "Bob Jones"
  ],
  "year": 2024,
  "doi": null,
  "arxiv_id": null,
  "source_path": "sources/docx/robust_transformer_models_for_optical_flow.docx",
  "parser": {
    "name": "docx",
    "version": "stdlib",
    "processed_at": "2026-08-31T12:00:00Z"
  },
  "block_count": 4,
  "asset_count": 0
}
